,Name,Url,Rating,Difficulty,Tags
0,Nutrition and Lifestyle in Pregnancy,https://coursera.org/learn/nutrition-pregnancy,4.8,Intermediate Level,"['Health', 'Nutrition']"
0,Six Sigma Principles,https://coursera.org/learn/six-sigma-principles,4.6,Beginner Level,"['Business', 'Business Essentials']"
0,"Creatividad, diseño e innovación: Técnicas y herramientas - Proyecto Final",https://coursera.org/learn/creatividad-proyecto-final,4.7,Intermediate Level,"['Computer Science', 'Design and Product']"
0,Songwriting: Writing the Lyrics,https://coursera.org/learn/songwriting-lyrics,4.9,Beginner Level,"['Arts and Humanities', 'Music and Art']"
0,Strategic Leadership and Management Capstone,https://coursera.org/learn/strategic-leadership-capstone,4.7,None,"['Business', 'Leadership and Management']"
0,Como aprimorar e monetizar seu aplicativo para iOS e Apple Watch,https://coursera.org/learn/ios-avancado,4.5,None,"['Computer Science', 'Mobile and Web Development']"
0,"Dense Gases, Liquids and Solids",https://coursera.org/learn/dense-gases-liquids-solids,None,Advanced Level,"['Physical Science and Engineering', 'Mechanical Engineering']"
0,Quantitative Formal Modeling and Worst-Case Performance Analysis,https://coursera.org/learn/quantitative-formal-modeling-1,4.4,None,"['Computer Science', 'Software Development']"
0,Financing and Initiating Major Engineering Projects,https://coursera.org/learn/financing-major-engineering-projects,4.4,Intermediate Level,"['Physical Science and Engineering', 'Mechanical Engineering']"
0,Vector Calculus for Engineers,https://coursera.org/learn/vector-calculus-engineers,5,Beginner Level,"['Math and Logic', 'Math and Logic']"
0,Teaching EFL/ESL Reading: A Task Based Approach,https://coursera.org/learn/esl-reading,4.7,Intermediate Level,"['Social Sciences', 'Education']"
0,Lesson | Video Conferencing: Face to Face but Online,https://coursera.org/learn/lesson-video-conferencing-face-to-face-but-online,None,None,"['Language Learning', 'Learning English']"
0,English for Journalism,https://coursera.org/learn/journalism,4.8,None,"['Language Learning', 'Learning English']"
0,Proyecto Final - Programa Especializado en Marketing Digital,https://coursera.org/learn/marketing-digital-proyecto-final,4.9,Beginner Level,"['Business', 'Marketing']"
0,Multimodal Literacies: Communication and Learning in the Era of Digital Media,https://coursera.org/learn/multimodal-literacies,4.9,None,"['Social Sciences', 'Education']"
0,Networking and Security in iOS Applications,https://coursera.org/learn/security,4.5,None,"['Computer Science', 'Computer Security and Networks']"
0,International Business II,https://coursera.org/learn/international-business-2,4.7,None,"['Business', 'Business Strategy']"
0,Wonders of Ancient Egypt,https://coursera.org/learn/wonders-ancient-egypt,4.8,Intermediate Level,"['Arts and Humanities', 'History']"
0,"Android App Components - Intents, Activities, and Broadcast Receivers",https://coursera.org/learn/androidapps,4.2,None,"['Computer Science', 'Mobile and Web Development']"
0,La escuela y su comunidad: lecciones desde la ruralidad,https://coursera.org/learn/escuela-comunidad-lecciones-innovacion-educativa,None,Beginner Level,"['Social Sciences', 'Education']"
0,Challenges of Agribusiness Management,https://coursera.org/learn/agribusiness-management-challenges,None,None,"['Business', 'Entrepreneurship']"
0,Project Execution,https://coursera.org/learn/project-execution,4.3,Beginner Level,"['Business', 'Leadership and Management']"
0,Enterprise and Infrastructure Security,https://coursera.org/learn/enterprise-infrastructure-security,4.7,Intermediate Level,"['Computer Science', 'Computer Security and Networks']"
0,Teaching Children with Visual Impairment: Creating Empowering Classrooms,https://coursera.org/learn/teach-children-with-visual-impairment,None,Beginner Level,"['Social Sciences', 'Education']"
0,Линейная алгебра (Linear Algebra),https://coursera.org/learn/algebra-lineynaya,4.5,Beginner Level,"['Math and Logic', 'Math and Logic']"
0,Менеджмент профессиональной траектории,https://coursera.org/learn/management-proftraektorii,4.7,Beginner Level,"['Business', 'Leadership and Management']"
0,GIS Data Acquisition and Map Design,https://coursera.org/learn/gis-data-acquisition-map-design,4.9,Beginner Level,"['Physical Science and Engineering', 'Environmental Science and Sustainability']"
0,Disaster Preparedness,https://coursera.org/learn/disaster-preparedness,4.7,Beginner Level,"['Physical Science and Engineering', 'Environmental Science and Sustainability']"
0,Urgent Optimism: How to Turn Foresight into Action,https://coursera.org/learn/urgent-optimism,4.8,Beginner Level,"['Business', 'Leadership and Management']"
0,How To Create a Website in a Weekend! (Project-Centered Course),https://coursera.org/learn/how-to-create-a-website,3.4,None,"['Computer Science', 'Mobile and Web Development']"
0,Machine Learning: Classification,https://coursera.org/learn/ml-classification,4.7,None,"['Data Science', 'Machine Learning']"
0,Lesson | Understand and Be Understood on the Phone,https://coursera.org/learn/lesson-understand-and-be-understood-on-the-phone,None,None,"['Language Learning', 'Learning English']"
0,Competitive Strategy,https://coursera.org/learn/competitive-strategy,4.7,None,"['Business', 'Business Strategy']"
0,Writing in First Person Point of View,https://coursera.org/learn/first-person-pov,4.8,None,"['Arts and Humanities', 'Music and Art']"
0,The Age of Sustainable Development,https://coursera.org/learn/sustainable-development,4.8,None,"['Physical Science and Engineering', 'Environmental Science and Sustainability']"
0,Communicating Business Analytics Results,https://coursera.org/learn/communicating-business-analytics-results,4.4,None,"['Data Science', 'Data Analysis']"
0,Data Structures and Algorithms (IV),https://coursera.org/learn/data-structures-algorithms-4,None,Intermediate Level,"['Computer Science', 'Algorithms']"
0,Think Again I: How to Understand Arguments,https://coursera.org/learn/understanding-arguments,4.6,Beginner Level,"['Personal Development', 'Personal Development']"
0,Web Design for Everybody Capstone,https://coursera.org/learn/web-design-project,4.8,None,"['Computer Science', 'Mobile and Web Development']"
0,Understanding User Needs,https://coursera.org/learn/understanding-user-needs,4.7,Beginner Level,"['Computer Science', 'Design and Product']"
0,Composición algorítmica en Supercollider,https://coursera.org/learn/composicion-algoritmica-supercollider,4.8,Intermediate Level,"['Computer Science', 'Software Development']"
0,Введение в искусственный интеллект,https://coursera.org/learn/vvedenie-v-iskusstvennyi-intellekt,4.9,Beginner Level,"['Computer Science', 'Computer Security and Networks']"
0,Foundations for Global Health Responders,https://coursera.org/learn/ghresponder,4.8,None,"['Health', 'Public Health']"
0,Intro to Acoustics (Part 1),https://coursera.org/learn/intro-to-acoustics,4.4,Intermediate Level,"['Physical Science and Engineering', 'Mechanical Engineering']"
0,"Speak English Professionally: In Person, Online & On the Phone",https://coursera.org/learn/speak-english-professionally,4.6,None,"['Language Learning', 'Learning English']"
0,Matrix Algebra for Engineers,https://coursera.org/learn/matrix-algebra-engineers,4.8,Beginner Level,"['Math and Logic', 'Math and Logic']"
0,"Teach English Now! Second Language Reading, Writing, and Grammar ",https://coursera.org/learn/tesol-writing,4.9,Beginner Level,"['Language Learning', 'Learning English']"
0,Espaço Mundial: Perspectivas França-Brasil,https://coursera.org/learn/espaco-mundial,4.8,Beginner Level,"['Social Sciences', 'Governance and Society']"
0,التقانة والمستشعرات النانوية - الجزء الاول,https://coursera.org/learn/taknulujia-alnnanu1,4.4,None,"['Physical Science and Engineering', 'Chemistry']"
0,Introduction to Computer Programming,https://coursera.org/learn/introduction-to-computer-programming,4.4,Beginner Level,"['Computer Science', 'Software Development']"
0,Management of Urban Infrastructures – part 1,https://coursera.org/learn/managing-urban-infrastructures-1,4.7,None,"['Business', 'Leadership and Management']"
0,Introduction to Android graphics,https://coursera.org/learn/intro-android-graphics,3.6,Intermediate Level,"['Computer Science', 'Mobile and Web Development']"
0,Indigenous Canada,https://coursera.org/learn/indigenous-canada,4.8,None,"['Arts and Humanities', 'History']"
0,Hadoop Platform and Application Framework,https://coursera.org/learn/hadoop,3.9,None,"['Data Science', 'Data Analysis']"
0,Управление стоимостью компании,https://coursera.org/learn/upravlenie-stoimostju-kompanii,4.6,Intermediate Level,"['Business', 'Finance']"
0,Functional Programming in Scala Capstone,https://coursera.org/learn/scala-capstone,4.4,None,"['Data Science', 'Data Analysis']"
0,Física: Dimensión y Movimiento,https://coursera.org/learn/fisica-dimension-movimiento,4.6,None,"['Physical Science and Engineering', 'Physics and Astronomy']"
0,Managing Data Analysis,https://coursera.org/learn/managing-data-analysis,4.5,None,"['Business', 'Leadership and Management']"
0,Architecting with Google Kubernetes Engine: Foundations 日本語版,https://coursera.org/learn/foundations-google-kubernetes-engine-gke-jp,None,Intermediate Level,"['Computer Science', 'Software Development']"
0,Controle de Sistemas no Plano-s,https://coursera.org/learn/controle-s,4.8,Intermediate Level,"['Physical Science and Engineering', 'Electrical Engineering']"
0,Gestão de Operações,https://coursera.org/learn/gestao-de-operacoes,4.8,Beginner Level,"['Business', 'Business Strategy']"
0,Windows Server Management and Security,https://coursera.org/learn/windows-server-management-security,4.6,Beginner Level,"['Information Technology', 'Security']"
0,3D-печать для всех и каждого,https://coursera.org/learn/3d-printing,4.7,None,"['Computer Science', 'Design and Product']"
0,Cómo hacer una tesis,https://coursera.org/learn/como-hacer-una-tesis,4.8,Beginner Level,"['Social Sciences', 'Education']"
0,Project Management: The Basics for Success,https://coursera.org/learn/project-management-basics,4.5,None,"['Business', 'Leadership and Management']"
0,Design and Make Infographics (Project-Centered Course),https://coursera.org/learn/infographic-design,4.7,None,"['Business', 'Business Essentials']"
0,Liderazgo para el Siglo XXI: proyecto final,https://coursera.org/learn/liderazgo,4.9,Intermediate Level,"['Personal Development', 'Personal Development']"
0,The Addicted Brain,https://coursera.org/learn/addiction-and-the-brain,4.6,Beginner Level,"['Health', 'Basic Science']"
0,Sales Pitch and Closing,https://coursera.org/learn/sales-pitch-closing,4.7,Beginner Level,"['Business', 'Business Essentials']"
0,Data Manipulation at Scale: Systems and Algorithms,https://coursera.org/learn/data-manipulation,4.3,None,"['Data Science', 'Data Analysis']"
0,"Comprendre l'écologie, pour une économie innovante",https://coursera.org/learn/ecologie,4.6,None,"['Physical Science and Engineering', 'Environmental Science and Sustainability']"
0,Constructores de Paz,https://coursera.org/learn/constructores-de-paz,4.8,Beginner Level,"['Personal Development', 'Personal Development']"
0,Design Thinking for Innovation,https://coursera.org/learn/uva-darden-design-thinking-innovation,4.6,Beginner Level,"['Business', 'Business Strategy']"
0,Market and Competition in Pricing Strategy,https://coursera.org/learn/uva-darden-bcg-pricing-strategy-market-competition,4.8,Beginner Level,"['Business', 'Marketing']"
0,EMT Foundations,https://coursera.org/learn/emt-foundations,4.9,Beginner Level,"['Health', 'Patient Care']"
0,"Forecasting, Budgeting, Territories, Evaluation and Legal/Ethical Issues",https://coursera.org/learn/forecasting-budgeting-territories-evaluation,3,Beginner Level,"['Business', 'Leadership and Management']"
0,Corporate finance: Know your numbers 2,https://coursera.org/learn/corporate-finance-know-your-numbers-2,None,Beginner Level,"['Business', 'Finance']"
0,Historia de las reglas del fútbol en Inglaterra y en Argentina,https://coursera.org/learn/historia-reglas-futbol,4.7,Beginner Level,"['Arts and Humanities', 'History']"
0,AI Workflow: Enterprise Model Deployment,https://coursera.org/learn/ibm-ai-workflow-machine-learning-model-deployment,None,Advanced Level,"['Data Science', 'Machine Learning']"
0,Machine Learning,https://coursera.org/learn/machine-learning,4.9,None,"['Data Science', 'Machine Learning']"
0,Take Your English Communication Skills to the Next Level,https://coursera.org/learn/english-communication-capstone,4.7,None,"['Language Learning', 'Learning English']"
0,What is Compliance?,https://coursera.org/learn/what-is-compliance,4.9,None,"['Business', 'Business Essentials']"
0,Human Rights for Open Societies,https://coursera.org/learn/humanrights,4.7,Beginner Level,"['Social Sciences', 'Law']"
0,Methods of Surface Analysis,https://coursera.org/learn/methods-surface-analysis,4.9,Intermediate Level,"['Physical Science and Engineering', 'Research Methods']"
0,Learn Mandarin Chinese: Capstone Project,https://coursera.org/learn/learn-mandarin-project,4.8,Beginner Level,"['Language Learning', 'Other Languages']"
0,Practical Time Series Analysis,https://coursera.org/learn/practical-time-series-analysis,4.6,Intermediate Level,"['Data Science', 'Probability and Statistics']"
0,Organizational Behavior: How to Manage People,https://coursera.org/learn/managing-people-iese,4.6,None,"['Business', 'Leadership and Management']"
0,Information Design,https://coursera.org/learn/infodesign,4.5,None,"['Computer Science', 'Design and Product']"
0,Geopolitics of Europe,https://coursera.org/learn/geopolitics-europe,4.4,None,"['Social Sciences', 'Governance and Society']"
0,American Contract Law II,https://coursera.org/learn/contracts-2,4.9,Beginner Level,"['Social Sciences', 'Law']"
0,Political Economy of Institutions and Development,https://coursera.org/learn/political-economy,4.7,Beginner Level,"['Social Sciences', 'Governance and Society']"
0,Çok değişkenli Fonksiyon II: Uygulamalar / Multivariable Calculus II: Applications,https://coursera.org/learn/calculus-diferansiyel-hesap,4.9,None,"['Math and Logic', 'Math and Logic']"
0,Engineering Project Management: Initiating and Planning,https://coursera.org/learn/initiating-planning,4.7,Beginner Level,"['Business', 'Leadership and Management']"
0,Fashion as Design,https://coursera.org/learn/fashion-design,4.9,Beginner Level,"['Arts and Humanities', 'Music and Art']"
0,Mécanique de Newton,https://coursera.org/learn/mecanique-newton,4.7,None,"['Physical Science and Engineering', 'Physics and Astronomy']"
0,Reproducible Templates for Analysis and Dissemination,https://coursera.org/learn/reproducible-templates-analysis,4.6,Beginner Level,"['Data Science', 'Data Analysis']"
0,An Introduction to Interactive Programming in Python (Part 2),https://coursera.org/learn/interactive-python-2,4.9,Beginner Level,"['Computer Science', 'Software Development']"
0,Privacy Law and Data Protection,https://coursera.org/learn/privacy-law-data-protection,4.8,None,"['Business', 'Business Essentials']"
0,A tecnologia da produção musical,https://coursera.org/learn/tecnologia-producao-musical,4.8,Beginner Level,"['Arts and Humanities', 'Music and Art']"
0,Smart Contracts,https://coursera.org/learn/smarter-contracts,4.6,Intermediate Level,"['Computer Science', 'Software Development']"
0,Violences et religions,https://coursera.org/learn/violences-religions,4.8,Beginner Level,"['Arts and Humanities', 'History']"
0,Estrategia de precios,https://coursera.org/learn/estrategia-precios,4.8,None,"['Business', 'Marketing']"
0,ELL Success in the Content Classroom: Capstone Project,https://coursera.org/learn/ell-project,4.3,None,"['Social Sciences', 'Education']"
0,Big Data Services: Capstone Project,https://coursera.org/learn/big-data-services,None,Advanced Level,"['Data Science', 'Machine Learning']"
0,Population Health: Panel Management Next Level,https://coursera.org/learn/panel-management,None,Intermediate Level,"['Health', 'Healthcare Management']"
0,"Online Games: Literature, New Media, and Narrative",https://coursera.org/learn/interactive-media-gaming,4.6,Beginner Level,"['Arts and Humanities', 'Music and Art']"
0,UX Design: From Concept to Prototype,https://coursera.org/learn/ux-design-concept-wireframe,4.7,Beginner Level,"['Computer Science', 'Design and Product']"
0,Accounting for Business Decision Making: Measurement and Operational Decisions,https://coursera.org/learn/business-accounting,4.1,Beginner Level,"['Business', 'Business Essentials']"
0,Google Cloud Platform Fundamentals: Core Infrastructure auf Deutsch,https://coursera.org/learn/gcp-fundamentals-de,4.4,Intermediate Level,"['Information Technology', 'Cloud Computing']"
0,Aléatoire : une introduction aux probabilités - Partie 1,https://coursera.org/learn/probabilites-1,4.4,None,"['Math and Logic', 'Math and Logic']"
0,Introducción a Data Science: Programación Estadística con R,https://coursera.org/learn/intro-data-science-programacion-estadistica-r,4.7,Beginner Level,"['Data Science', 'Data Analysis']"
0,Digital Systems: From Logic Gates to Processors,https://coursera.org/learn/digital-systems,4.5,Intermediate Level,"['Physical Science and Engineering', 'Electrical Engineering']"
0,Economie du sol et de l'immobilier II,https://coursera.org/learn/economie-sol-immobilier-2,4.7,Intermediate Level,"['Social Sciences', 'Economics']"
0,Creativity Toolkit II: Creative Collaboration,https://coursera.org/learn/creativity-toolkit-2,4.7,None,"['Business', 'Entrepreneurship']"
0,Big Data Analysis with Scala and Spark,https://coursera.org/learn/scala-spark-big-data,4.7,None,"['Computer Science', 'Algorithms']"
0,Reporting extra-financier et stratégie RSE,https://coursera.org/learn/reporting-extra-financier-strategie-rse,4.7,Beginner Level,"['Business', 'Leadership and Management']"
0,Corruption,https://coursera.org/learn/wharton-corruption,4.6,Intermediate Level,"['Social Sciences', 'Governance and Society']"
0,Michigan Sport-Related Concussion Training Certification,https://coursera.org/learn/michigan-sport-related-concussion-training-certification,4.8,Beginner Level,"['Health', 'Public Health']"
0,"Textual Elements of Design: Fonts, Typography, and Spacing",https://coursera.org/learn/fonts-typography-spacing,4.6,Beginner Level,"['Arts and Humanities', 'History']"
0,Системное мышление,https://coursera.org/learn/system-thinking,4.6,Beginner Level,"['Business', 'Entrepreneurship']"
0,Project: Writing a Research Paper,https://coursera.org/learn/academic-writing-capstone,4.8,None,"['Language Learning', 'Learning English']"
0,Advanced Speaking and Listening Project,https://coursera.org/learn/speaking-listening-capstone,None,Intermediate Level,"['Language Learning', 'Learning English']"
0,Character Setup and Animation,https://coursera.org/learn/character-setup-animation,4.8,Intermediate Level,"['Computer Science', 'Design and Product']"
0,Essential Cloud Infrastructure: Foundation en Français,https://coursera.org/learn/gcp-infrastructure-foundation-fr,4.8,Intermediate Level,"['Information Technology', 'Cloud Computing']"
0,Internet of Things V2: DragonBoard™ bring up and community ecosystem,https://coursera.org/learn/internet-of-things-dragonboard-version2,3.5,None,"['Physical Science and Engineering', 'Electrical Engineering']"
0,Comprender las dimensiones interculturales en la cotidianidad,https://coursera.org/learn/interculturalidad,None,Intermediate Level,"['Personal Development', 'Personal Development']"
0,Setting the Stage for Success: An Eye on Safety Culture and Teamwork (Patient Safety II),https://coursera.org/learn/patient-safety-culture,4.8,None,"['Health', 'Healthcare Management']"
0,ГМО: технологии создания и применение,https://coursera.org/learn/gmo,4.9,None,"['Health', 'Nutrition']"
0,Programación Orientada a Objetos con Python,https://coursera.org/learn/programacion-python-objetos,None,Beginner Level,"['Computer Science', 'Software Development']"
0,Posicionamiento: La base del éxito en la estrategia de marketing,https://coursera.org/learn/posicionamiento,4.7,Beginner Level,"['Business', 'Marketing']"
0,Chino básico: Cómo dar una primera impresión positiva,https://coursera.org/learn/chino-primera-impresion,4.3,None,"['Language Learning', 'Other Languages']"
0,L'excellence opérationnelle en pratique,https://coursera.org/learn/excellence-operationnelle,4.7,Beginner Level,"['Business', 'Leadership and Management']"
0,"Be a Leader, Develop a Leader",https://coursera.org/learn/be-a-leader,4.8,None,"['Business', 'Leadership and Management']"
0,Global Trends for Business and Society,https://coursera.org/learn/wharton-global-trends-business,4.8,None,"['Social Sciences', 'Governance and Society']"
0,Finance for Everyone: Decisions,https://coursera.org/learn/finance-decisions,4.6,None,"['Business', 'Finance']"
0,Building AI Powered Chatbots Without Programming,https://coursera.org/learn/building-ai-powered-chatbots,4.8,Beginner Level,"['Computer Science', 'Design and Product']"
0,Introduction to Augmented Reality and ARCore,https://coursera.org/learn/ar,4.4,Beginner Level,"['Computer Science', 'Mobile and Web Development']"
0,Digital Signal Processing,https://coursera.org/learn/dsp,4.7,Intermediate Level,"['Physical Science and Engineering', 'Electrical Engineering']"
0,Storytelling and influencing: Communicate with impact,https://coursera.org/learn/communicate-with-impact,4.8,None,"['Business', 'Leadership and Management']"
0,Copyright Law in the Music Business,https://coursera.org/learn/copyright-law-music-business,4.8,Beginner Level,"['Business', 'Business Strategy']"
0,Управление инновационными проектами,https://coursera.org/learn/innovacionnye-proekty,4.5,Intermediate Level,"['Business', 'Business Essentials']"
0,English for Research Publication Purposes: Capstone Project,https://coursera.org/learn/english-for-research-publication-purposes-capstone-project,None,Intermediate Level,"['Language Learning', 'Learning English']"
0,"Nanotechnology and Nanosensors, Part 2",https://coursera.org/learn/nanotechnology2,4.7,None,"['Physical Science and Engineering', 'Chemistry']"
0,Целевые капиталы - территория финансовой стабильности в некоммерческом секторе,https://coursera.org/learn/tselevyye-kapitaly,4.8,Beginner Level,"['Business', 'Finance']"
0,La gestión de los riesgos y la administración de los cambios en el proyecto,https://coursera.org/learn/presupuestos-proyecto,4.7,None,"['Business', 'Leadership and Management']"
0,Introduction to Web Development,https://coursera.org/learn/web-development,4.7,Beginner Level,"['Computer Science', 'Mobile and Web Development']"
0,Алгоритмизация вычислений (Algorithmic computation),https://coursera.org/learn/algoritmizacija-vychislenij,4.6,Beginner Level,"['Computer Science', 'Algorithms']"
0,Dairy Production and Management,https://coursera.org/learn/dairy-production,4.8,None,"['Health', 'Animal Health']"
0,Business Model Innovation,https://coursera.org/learn/business-model,4.7,None,"['Business', 'Business Strategy']"
0,"Abstraction, Problem Decomposition, and Functions",https://coursera.org/learn/abstraction-problem-decomposition-functions,None,Beginner Level,"['Computer Science', 'Software Development']"
0,Open Source Software Development Methods,https://coursera.org/learn/open-source-software-development-methods,4.5,Beginner Level,"['Computer Science', 'Software Development']"
0,Autism Spectrum Disorder,https://coursera.org/learn/autism-spectrum-disorder,4.6,None,"['Health', 'Patient Care']"
0,Introduction to Cataract Surgery,https://coursera.org/learn/cataract-surgery,4.8,Advanced Level,"['Health', 'Patient Care']"
0,Music and Social Action,https://coursera.org/learn/music-and-social-action,4.5,None,"['Arts and Humanities', 'Music and Art']"
0,Introduction to Integrative Therapies and Healing Practices,https://coursera.org/learn/integrative-therapies-and-healing-practices,4.8,Beginner Level,"['Health', 'Patient Care']"
0,TCP/IP and Advanced Topics,https://coursera.org/learn/tcp-ip-advanced,4.4,None,"['Computer Science', 'Computer Security and Networks']"
0,Advanced Business Strategy,https://coursera.org/learn/uva-darden-advanced-business-strategy,4.7,Beginner Level,"['Business', 'Business Strategy']"
0,Desarrollo de aplicaciones avanzadas con Android,https://coursera.org/learn/aplicaciones-android,4.8,None,"['Computer Science', 'Mobile and Web Development']"
0,Gestão de Riscos e de Mudanças em Projetos,https://coursera.org/learn/riscos-mudancas-em-projetos,4.9,None,"['Business', 'Leadership and Management']"
0,Mandarin Chinese for Intermediate Learners: Capstone Project,https://coursera.org/learn/mandarin-chinese-intermediate-learner-capstone,None,Intermediate Level,"['Language Learning', 'Other Languages']"
0,Design and Analyze Secure Networked Systems,https://coursera.org/learn/design-secure-networked-systems,3.8,Intermediate Level,"['Computer Science', 'Computer Security and Networks']"
0,Applications in Engineering Mechanics,https://coursera.org/learn/engineering-mechanics-statics-2,4.8,None,"['Physical Science and Engineering', 'Mechanical Engineering']"
0,"Cannabis, Mental Health, and Brain Disorders",https://coursera.org/learn/mentalhealth-cannabis-cbd-thc,4.7,Beginner Level,"['Health', 'Public Health']"
0,Tesoros de la Física y sus Descubridores I,https://coursera.org/learn/tesoros-de-la-fisica,4.8,Beginner Level,"['Physical Science and Engineering', 'Physics and Astronomy']"
