,Name,Url,Rating,Difficulty,Tags
0,"""Making"" Progress Teach-Out",https://coursera.org/learn/makingprogress,None,Beginner Level,"['Social Sciences', 'Governance and Society']"
1,(Business Writing) الكتابة في مجال الأعمال,https://coursera.org/learn/writing-for-business-ar,None,Beginner Level,"['Business', 'Business Essentials']"
2,(Giving Helpful Feedback) إعطاء الملاحظات المفيدة,https://coursera.org/learn/feedback-ar,4.8,None,"['Business', 'Business Essentials']"
3,(Successful Presentation) العرض التقديمي الناجح,https://coursera.org/learn/presentation-skills-ar,4.9,Beginner Level,"['Business', 'Business Essentials']"
4,.Net平台下的软件开发技术毕业项目,https://coursera.org/learn/net-ruanjian-kaifa-biye,None,None,"['Computer Science', 'Software Development']"
5,1.- El Cálculo - Modelo Lineal,https://coursera.org/learn/calculo-1,4.7,None,"['Math and Logic', 'Math and Logic']"
6,2.- El Cálculo - Modelo Cuadrático,https://coursera.org/learn/calculo-2,4.7,None,"['Math and Logic', 'Math and Logic']"
7,20世纪西方音乐 Western Music in the 20th Century,https://coursera.org/learn/20cnwm,4.3,Beginner Level,"['Arts and Humanities', 'Music and Art']"
8,3-Axis Machining with Autodesk Fusion 360,https://coursera.org/learn/3-axis-machining-autodesk-fusion-360,5,Advanced Level,"['Physical Science and Engineering', 'Mechanical Engineering']"
9,3.- El Cálculo - Modelo Cúbico,https://coursera.org/learn/calculo-3,4.7,None,"['Math and Logic', 'Math and Logic']"
0,3D Art and Audio Pipeline,https://coursera.org/learn/3d-art-and-audio-pipeline,4.3,Intermediate Level,"['Computer Science', 'Software Development']"
1,3D CAD Application,https://coursera.org/learn/3d-cad-application,4.9,Intermediate Level,"['Physical Science and Engineering', 'Mechanical Engineering']"
2,3D CAD Fundamental,https://coursera.org/learn/3d-cad-fundamental,4.8,Beginner Level,"['Physical Science and Engineering', 'Mechanical Engineering']"
3,3D Data Visualization for Science Communication,https://coursera.org/learn/data-visualization-science-communication,None,Beginner Level,"['Data Science', 'Data Analysis']"
4,3D Graphics in Android: Sensors and VR,https://coursera.org/learn/3d-graphics-android-sensors-vr,None,Advanced Level,"['Computer Science', 'Mobile and Web Development']"
5,Atención prehospitalaria del ictus agudo y selección de pacientes para tratamiento endovascular con la escala RACE,https://coursera.org/learn/ictus-agudo-escala-race,4.8,Intermediate Level,"['Health', 'Patient Care']"
6,Brand & Content Marketing,https://coursera.org/learn/brand-and-content-marketing,4.5,Intermediate Level,"['Arts and Humanities', 'History']"
7," Comercio, Inmigración y Tipos de Cambio en un Mundo Globalizado",https://coursera.org/learn/comercio-inmigracion-tipos-de-cambio,5,Beginner Level,"['Social Sciences', 'Economics']"
8,FPGA computing systems: Background knowledge and introductory materials,https://coursera.org/learn/fpga-intro,4.6,Beginner Level,"['Computer Science', 'Design and Product']"
9,Future Healthcare Payment Models,https://coursera.org/learn/healthcare-payment-models,4.4,Beginner Level,"['Health', 'Healthcare Management']"
0,Введение в iOS-разработку,https://coursera.org/learn/ios-razrabotka-na-swift,4.4,Intermediate Level,"['Computer Science', 'Mobile and Web Development']"
1,Geospatial and Environmental Analysis,https://coursera.org/learn/spatial-analysis,4.8,Intermediate Level,"['Physical Science and Engineering', 'Environmental Science and Sustainability']"
2,Combinatorics and Probability,https://coursera.org/learn/combinatorics,4.6,Beginner Level,"['Computer Science', 'Algorithms']"
3,Introducción a la Contabilidad Financiera,https://coursera.org/learn/wharton-contabilidad-financiera,4.6,None,"['Business', 'Business Strategy']"
4,"Surveillance Systems: Analysis, Dissemination, and Special Systems",https://coursera.org/learn/epidemiology-surveillance-systems-analysis,None,Beginner Level,"['Health', 'Public Health']"
5,Базы данных (Databases),https://coursera.org/learn/data-bases-intr,4.3,None,"['Data Science', 'Data Analysis']"
6,Finance for Everyone: Debt,https://coursera.org/learn/finance-debt,4.7,None,"['Business', 'Finance']"
7,Managing Big Data with MySQL,https://coursera.org/learn/analytics-mysql,4.7,None,"['Data Science', 'Data Analysis']"
8,Managing an Agile Team,https://coursera.org/learn/uva-darden-agile-team-management,4.7,None,"['Computer Science', 'Design and Product']"
9,ООП и паттерны проектирования в Python,https://coursera.org/learn/oop-patterns-python,3.8,Intermediate Level,"['Computer Science', 'Software Development']"
0,Introduction to advanced tomography,https://coursera.org/learn/cinemaxe,None,None,"['Physical Science and Engineering', 'Physics and Astronomy']"
1,Launching into Machine Learning en Français,https://coursera.org/learn/launching-machine-learning-fr,None,Intermediate Level,"['Data Science', 'Machine Learning']"
2,Creative Programming for Digital Media & Mobile Apps,https://coursera.org/learn/digitalmedia,4.3,None,"['Computer Science', 'Software Development']"
3,Spanish for Successful Communication in Healthcare Settings,https://coursera.org/learn/spanish-in-healthcare-settings,4.8,Intermediate Level,"['Health', 'Patient Care']"
4,Digital Product Management: Modern Fundamentals,https://coursera.org/learn/uva-darden-digital-product-management,4.7,Beginner Level,"['Business', 'Leadership and Management']"
5,Digital Competition in Financial Services,https://coursera.org/learn/digital-competition-financial-services,4.6,Beginner Level,"['Business', 'Business Strategy']"
6,Mathematics for Machine Learning: PCA,https://coursera.org/learn/pca-machine-learning,4,Intermediate Level,"['Data Science', 'Machine Learning']"
7,"Programming Foundations with JavaScript, HTML and CSS",https://coursera.org/learn/duke-programming-web,4.6,Beginner Level,"['Computer Science', 'Mobile and Web Development']"
8,Погружение в Python,https://coursera.org/learn/diving-in-python,4.7,Intermediate Level,"['Computer Science', 'Software Development']"
9,Probabilistic Graphical Models 2: Inference,https://coursera.org/learn/probabilistic-graphical-models-2-inference,4.6,Advanced Level,"['Data Science', 'Machine Learning']"
0,Evidence-based Toxicology,https://coursera.org/learn/evidence-based-toxicology,4.8,Beginner Level,"['Health', 'Basic Science']"
1,Identifying Social Entrepreneurship Opportunities,https://coursera.org/learn/social-entrepreneurship-opportunities,4.6,Beginner Level,"['Business', 'Entrepreneurship']"
2,Launching into Machine Learning,https://coursera.org/learn/launching-machine-learning,4.6,Intermediate Level,"['Data Science', 'Machine Learning']"
3,Global Strategy I: How The Global Economy Works,https://coursera.org/learn/global-strategy,4.9,None,"['Business', 'Business Strategy']"
4,Quantitative Research,https://coursera.org/learn/quantitative-research,4.2,Intermediate Level,"['Business', 'Marketing']"
5,Sprachtechnologie in den Digital Humanities,https://coursera.org/learn/digital-humanities,4.8,Beginner Level,"['Data Science', 'Data Analysis']"
6,Learn to Program: The Fundamentals,https://coursera.org/learn/learn-to-program,4.8,Beginner Level,"['Computer Science', 'Software Development']"
7,Evaluación educativa del y para el aprendizaje en educación superior,https://coursera.org/learn/evaluacion-educativa,4.8,Beginner Level,"['Social Sciences', 'Education']"
8,Social Computing,https://coursera.org/learn/social-computing,4.4,None,"['Social Sciences', 'Governance and Society']"
9,Image and Video Processing: From Mars to Hollywood with a Stop at the Hospital,https://coursera.org/learn/image-processing,4.7,None,"['Math and Logic', 'Math and Logic']"
0,Getting started in cryo-EM,https://coursera.org/learn/cryo-em,4.9,None,"['Health', 'Research']"
1,Forensic Accounting and Fraud Examination,https://coursera.org/learn/forensic-accounting,4.7,None,"['Business', 'Finance']"
2,Compra programática de medios: Publicidad online en tiempo real,https://coursera.org/learn/compra-programatica,4.7,Beginner Level,"['Business', 'Marketing']"
3,Strategic Business Management - Macroeconomics,https://coursera.org/learn/strategic-business-management-macroeconomics,4.8,Beginner Level,"['Business', 'Business Strategy']"
4,Data in Database,https://coursera.org/learn/data-in-database,3.6,Intermediate Level,"['Information Technology', 'Data Management']"
5,Exploring ​and ​Preparing ​your ​Data with BigQuery 日本語版,https://coursera.org/learn/gcp-exploring-preparing-data-bigquery-jp,None,Beginner Level,"['Information Technology', 'Data Management']"
6,Competencias digitales. Bases de datos: Access,https://coursera.org/learn/competencias-digitales-access,4.7,Beginner Level,"['Personal Development', 'Personal Development']"
7,世界空间、法国视角下的国际研究,https://coursera.org/learn/espace-mondial-cn,4.7,Beginner Level,"['Social Sciences', 'Governance and Society']"
8,Climate Change and Water in Mountains: A Global Concern,https://coursera.org/learn/climate-changes-mountains-water,4.5,Intermediate Level,"['Physical Science and Engineering', 'Environmental Science and Sustainability']"
9,Introduction to Systems Biology,https://coursera.org/learn/systems-biology,4.3,None,"['Health', 'Basic Science']"
0,"Tropical Parasitology: Protozoans, Worms, Vectors and Human Diseases",https://coursera.org/learn/parasitology,4.7,Intermediate Level,"['Health', 'Basic Science']"
1,Managerial Accounting Fundamentals,https://coursera.org/learn/uva-darden-managerial-accounting,4.8,Beginner Level,"['Business', 'Finance']"
2,The Strategy of Content Marketing,https://coursera.org/learn/content-marketing,4.5,Intermediate Level,"['Business', 'Marketing']"
3,Lesson | Get Ready for the Interview,https://coursera.org/learn/lesson-get-ready-for-the-interview,None,None,"['Language Learning', 'Learning English']"
4,The Science of Training Young Athletes,https://coursera.org/learn/youth-sports,4.8,Beginner Level,"['Personal Development', 'Personal Development']"
5,Build Your First Android App (Project-Centered Course),https://coursera.org/learn/android-app,4.3,None,"['Computer Science', 'Mobile and Web Development']"
6,Avatar Psychology for Designers,https://coursera.org/learn/avatar-psychology-for-designers,None,Beginner Level,"['Computer Science', 'Software Development']"
7,Building Resilient Streaming Analytics Systems on GCP,https://coursera.org/learn/streaming-analytics-systems-gcp,4.8,Intermediate Level,"['Information Technology', 'Cloud Computing']"
8,Introduction to Applied Machine Learning,https://coursera.org/learn/machine-learning-applied,4.7,Intermediate Level,"['Data Science', 'Machine Learning']"
9,Introduction to Climate Change and Health,https://coursera.org/learn/introduction-climate-change-health,4.7,Beginner Level,"['Health', 'Public Health']"
0,Экономика предприятия,https://coursera.org/learn/ekonomika-predpriyatiya,4.5,None,"['Business', 'Business Essentials']"
1,Organic Solar Cells - Theory and Practice,https://coursera.org/learn/solar-cell,4.6,None,"['Physical Science and Engineering', 'Chemistry']"
2,Introducción a la Calidad,https://coursera.org/learn/gestion-de-productividad,4.6,None,"['Business', 'Business Strategy']"
3,Analytic Combinatorics,https://coursera.org/learn/analytic-combinatorics,4.7,Intermediate Level,"['Math and Logic', 'Math and Logic']"
4,Supply chain management: Be global,https://coursera.org/learn/supply-chain-management-global,4.8,Beginner Level,"['Business', 'Business Strategy']"
5,Практики управленческой аналитики в MS Excel,https://coursera.org/learn/praktiki-upravlencheskoy-analitiki-excel,4.8,Intermediate Level,"['Business', 'Business Essentials']"
6,Introducción al mundo de las negociaciones,https://coursera.org/learn/estrategias-de-negociacion,4.8,None,"['Business', 'Business Essentials']"
7,Desenvolvimento Ágil com Padrões de Projeto,https://coursera.org/learn/desenvolvimento-agil-com-padroes-de-projeto,4.7,Intermediate Level,"['Computer Science', 'Software Development']"
8,CAPSTONE: Your Leadership Challenge,https://coursera.org/learn/leadership-challenge,4.5,None,"['Business', 'Leadership and Management']"
9,Learning Chinese : Start From Scratch (零到一學中文),https://coursera.org/learn/learn-chinese-mandarin,4.5,Beginner Level,"['Language Learning', 'Other Languages']"
0,Foundations of Teaching for Learning: Planning for Teaching and Learning,https://coursera.org/learn/teaching-plan,4.8,None,"['Social Sciences', 'Education']"
1,"The Modern World, Part One: Global History from 1760 to 1910",https://coursera.org/learn/modern-world,4.8,Beginner Level,"['Arts and Humanities', 'History']"
2,Effective Problem-Solving and Decision-Making,https://coursera.org/learn/problem-solving,4.3,None,"['Business', 'Business Essentials']"
3,Health for All Through Primary Health Care,https://coursera.org/learn/health-for-all,4.7,None,"['Health', 'Patient Care']"
4,Обобщенные линейные модели,https://coursera.org/learn/obobshchennye-linejnye-modeli,None,Intermediate Level,"['Data Science', 'Probability and Statistics']"
5,Introduction to Complex Analysis,https://coursera.org/learn/complex-analysis,4.8,Intermediate Level,"['Math and Logic', 'Math and Logic']"
6,Organizational Design and Management,https://coursera.org/learn/organizational-design-management,4.7,Beginner Level,"['Business', 'Business Strategy']"
7,Internet of Things: Communication Technologies,https://coursera.org/learn/internet-of-things-communication,4.5,None,"['Computer Science', 'Computer Security and Networks']"
8,Global Environmental Management,https://coursera.org/learn/global-environmental-management,4.6,Intermediate Level,"['Physical Science and Engineering', 'Environmental Science and Sustainability']"
9,K-12 Blended & Online Learning,https://coursera.org/learn/k-12-online-education,4.7,None,"['Social Sciences', 'Education']"
0,Inglés Empresarial: Gestión y Liderazgo,https://coursera.org/learn/ingles-empresarial-gestion-liderazgo,4.7,None,"['Language Learning', 'Learning English']"
1,خيارات لسانية لمحترفي الإعلام باللغة العربية,https://coursera.org/learn/arabic-for-media,4.9,Beginner Level,"['Language Learning', 'Learning English']"
2,Introduction to Deep Learning,https://coursera.org/learn/intro-to-deep-learning,4.6,Advanced Level,"['Data Science', 'Machine Learning']"
3,Creative Writing: The Craft of Style,https://coursera.org/learn/craft-of-style,4.7,None,"['Arts and Humanities', 'Music and Art']"
4,Брендинг в инновациях - новая коммуникационная реальность,https://coursera.org/learn/brending-v-innovaciyah,5,None,"['Business', 'Marketing']"
5,Recommender Systems:  Evaluation and Metrics,https://coursera.org/learn/recommender-metrics,4.3,None,"['Data Science', 'Machine Learning']"
6,Giving 2.0: The MOOC,https://coursera.org/learn/philanthropist,4.6,None,"['Business', 'Business Strategy']"
7,Lesson | Business English Skills: Introducing Yourself in Business Settings,https://coursera.org/learn/lesson-business-english-skills-introducing-yourself-in-business-settings,None,Intermediate Level,"['Language Learning', 'Learning English']"
8,Survey analysis to Gain Marketing Insights,https://coursera.org/learn/survey-analysis-marketing-insights,4.4,None,"['Business', 'Marketing']"
9,Construction Project Management,https://coursera.org/learn/construction-project-management,4.8,Beginner Level,"['Business', 'Business Strategy']"
0,Ignite Your Everyday Creativity,https://coursera.org/learn/ignite-creativity,4.4,None,"['Personal Development', 'Personal Development']"
1,Logic for Economists,https://coursera.org/learn/logic-for-economists,4.4,Advanced Level,"['Math and Logic', 'Math and Logic']"
2,"Introduction to the Nonprofit Sector, Nonprofit Organizations, Nonprofit Leadership and Governance",https://coursera.org/learn/nonprofit-organizations,4.4,None,"['Business', 'Leadership and Management']"
3,Negocios Internacionales I,https://coursera.org/learn/negocios-internacionales,4.7,None,"['Business', 'Business Strategy']"
4,Физика в опытах. Часть 3. Колебания и молекулярная физика,https://coursera.org/learn/molekulyarnaya-fizika,4.8,None,"['Physical Science and Engineering', 'Physics and Astronomy']"
5,Mathematical Biostatistics Boot Camp 1,https://coursera.org/learn/biostatistics,4.5,None,"['Math and Logic', 'Math and Logic']"
6,Introduction to Research for Essay Writing,https://coursera.org/learn/introduction-to-research-for-essay-writing,4.7,None,"['Arts and Humanities', 'Music and Art']"
7,Intelligence Tools for the Digital Age,https://coursera.org/learn/intelligence-tools-digital-age,4.6,Beginner Level,"['Business', 'Leadership and Management']"
8,Tinkering Fundamentals: Circuits,https://coursera.org/learn/tinkering-circuits,4.7,Beginner Level,"['Personal Development', 'Personal Development']"
9,Marketing Internacional en Asia,https://coursera.org/learn/marketing-internacional-asia,4.8,Beginner Level,"['Business', 'Marketing']"
0,Foundations of Public Health Practice: Behaviour & Behaviour Change,https://coursera.org/learn/behaviour-change-in-public-health,None,Advanced Level,"['Health', 'Public Health']"
1,"Designing, Running, and Analyzing Experiments",https://coursera.org/learn/designexperiments,3.7,Intermediate Level,"['Computer Science', 'Design and Product']"
2,Контекстная реклама. Google AdWords,https://coursera.org/learn/kontextnaya-reklama-google-adwords,4.6,Intermediate Level,"['Business', 'Marketing']"
3,Valuation for Startups Using Multiple Approach,https://coursera.org/learn/valuation-multiples,4.2,Beginner Level,"['Business', 'Finance']"
4,Gestion et Politique de l'eau,https://coursera.org/learn/gestion-eau,4.6,None,"['Social Sciences', 'Law']"
5,"Бизнес-процессы, организационное проектирование, механизмы и системы управления",https://coursera.org/learn/systems-engineering-4,4.3,Intermediate Level,"['Business', 'Leadership and Management']"
6,Administração Financeira,https://coursera.org/learn/administracao-financeira,4.8,Beginner Level,"['Business', 'Finance']"
7,"Global Postharvest Loss Prevention: Fundamentals, Technologies, and Actors",https://coursera.org/learn/postharvest,4.8,Beginner Level,"['Physical Science and Engineering', 'Environmental Science and Sustainability']"
8,Blockchain Platforms,https://coursera.org/learn/blockchain-platforms,4.6,Intermediate Level,"['Computer Science', 'Software Development']"
9,Invitation to Mathematics     הזמנה למתמטיקה,https://coursera.org/learn/introduction-to-math,4.5,None,"['Math and Logic', 'Math and Logic']"
0,Человеческий фактор в разработке корпоративных систем,https://coursera.org/learn/chelovecheskiy-faktor-razrabotke-korporativnykh-sistem,None,None,"['Business', 'Leadership and Management']"
1,Креативная коммуникация: методы и инструменты,https://coursera.org/learn/kreativnaya-kommunikatsiya,4.7,Advanced Level,"['Arts and Humanities', 'Music and Art']"
2,Creating New BigQuery Datasets and Visualizing Insights,https://coursera.org/learn/gcp-creating-bigquery-datasets-visualizing-insights,4.6,Beginner Level,"['Information Technology', 'Data Management']"
3,Mindware: Critical Thinking for the Information Age,https://coursera.org/learn/mindware,4.7,Beginner Level,"['Health', 'Psychology']"
4,"Healthy Practices: Nutrition, Physical Activity, and Community and Family Participation",https://coursera.org/learn/healthy-practices-nutrition-physical-activity-community-family-participation,4.9,Beginner Level,"['Health', 'Nutrition']"
5,"Android App Components - Services, Local IPC, and Content Providers",https://coursera.org/learn/androidapps-2,4.3,Beginner Level,"['Computer Science', 'Mobile and Web Development']"
6,Big Data: visualización de datos,https://coursera.org/learn/big-data-visualizacion-datos,4.6,Intermediate Level,"['Data Science', 'Data Analysis']"
7,Strategic Career Self-Management,https://coursera.org/learn/strategic-career-self-management,4.4,None,"['Personal Development', 'Personal Development']"
8,Web Connectivity and Security in Embedded Systems,https://coursera.org/learn/iot-connectivity-security,4.6,Intermediate Level,"['Computer Science', 'Computer Security and Networks']"
9,Introduction to Spreadsheets and Models,https://coursera.org/learn/wharton-introduction-spreadsheets-models,4.2,None,"['Business', 'Business Essentials']"
0,Powerful Tools for Teaching and Learning: Web 2.0 Tools,https://coursera.org/learn/teaching-learning-tools,4.6,Beginner Level,"['Social Sciences', 'Education']"
1,Social Media Data Analytics,https://coursera.org/learn/social-media-data-analytics,4.1,Intermediate Level,"['Data Science', 'Data Analysis']"
2,Advanced Portfolio Construction and Analysis with Python,https://coursera.org/learn/advanced-portfolio-construction-python,4.8,Intermediate Level,"['Business', 'Finance']"
3,Marketing Analytics,https://coursera.org/learn/uva-darden-market-analytics,4.6,Beginner Level,"['Business', 'Marketing']"
4,Creativity Toolkit I: Changing Perspectives,https://coursera.org/learn/creativity-toolkit-1,4.7,None,"['Business', 'Entrepreneurship']"
5,The Importance and Power of Music in our Society,https://coursera.org/learn/importance-power-music-our-society,4.6,Beginner Level,"['Arts and Humanities', 'Music and Art']"
6,International Security Management,https://coursera.org/learn/international-security-management,None,Beginner Level,"['Social Sciences', 'Governance and Society']"
7,International Law In Action: Investigating and Prosecuting International Crimes,https://coursera.org/learn/international-law-in-action-2,4.8,None,"['Social Sciences', 'Law']"
8,Decision-Making and Scenarios,https://coursera.org/learn/wharton-decision-making-scenarios,4.6,None,"['Business', 'Business Essentials']"
9,Fundamentals of Visualization with Tableau,https://coursera.org/learn/data-visualization-tableau,4.5,Beginner Level,"['Data Science', 'Data Analysis']"
0,Data Mining Project,https://coursera.org/learn/data-mining-project,4.6,None,"['Data Science', 'Data Analysis']"
1,Diode - pn Junction and Metal Semiconductor Contact,https://coursera.org/learn/diode-pn-junction-metal-semiconductor-contact,4.1,Advanced Level,"['Physical Science and Engineering', 'Electrical Engineering']"
2,Managerial Economics and Business Analysis Capstone,https://coursera.org/learn/managerial-economics-capstone,4.6,Beginner Level,"['Business', 'Business Essentials']"
3,A Life of Happiness and Fulfillment,https://coursera.org/learn/happiness,4.8,None,"['Health', 'Psychology']"
4,Machine Learning with Python,https://coursera.org/learn/machine-learning-with-python,4.7,Intermediate Level,"['Data Science', 'Machine Learning']"
5,"The Music of the Rolling Stones, 1962-1974",https://coursera.org/learn/rolling-stones,4.8,None,"['Arts and Humanities', 'Music and Art']"
6,"Innovation Through Design: Think, Make, Break, Repeat",https://coursera.org/learn/innovation-through-design,4.8,Beginner Level,"['Business', 'Entrepreneurship']"
7,Improving Communication Skills,https://coursera.org/learn/wharton-communication-skills,4.6,Beginner Level,"['Personal Development', 'Personal Development']"
8,Creatividad computacional,https://coursera.org/learn/creatividad-computacional,None,Intermediate Level,"['Computer Science', 'Algorithms']"
9,Communicating Data Science Results,https://coursera.org/learn/data-results,3.6,None,"['Data Science', 'Data Analysis']"
0,Design Thinking,https://coursera.org/learn/design-thinking-innovation,4.6,Beginner Level,"['Business', 'Entrepreneurship']"
1,Modern American Poetry,https://coursera.org/learn/modern-american-poetry,4.5,Beginner Level,"['Arts and Humanities', 'Music and Art']"
2,More Chinese for Beginners,https://coursera.org/learn/more-chinese-for-beginners,4.7,None,"['Language Learning', 'Other Languages']"
3,Aspectos básicos de la planificación y la gestión de proyectos,https://coursera.org/learn/uva-darden-project-management-es,4.9,Beginner Level,"['Business', 'Business Essentials']"
4,The Modern and the Postmodern (Part 2),https://coursera.org/learn/modern-postmodern-2,4.7,None,"['Arts and Humanities', 'History']"
5,Marketing Gerencial,https://coursera.org/learn/marketing-gerencial,4.8,Intermediate Level,"['Business', 'Finance']"
6,Основы микроэкономики (Microeconomics Principles),https://coursera.org/learn/mikroekonomika,4.5,Beginner Level,"['Social Sciences', 'Economics']"
7,Leading transformations: Manage change,https://coursera.org/learn/change-management,4.5,Beginner Level,"['Business', 'Leadership and Management']"
8,Cómo autoconstruir tu vivienda. Segunda etapa,https://coursera.org/learn/como-autoconstruir-tu-vivienda-segunda-etapa,4.8,Beginner Level,"['Physical Science and Engineering', 'Electrical Engineering']"
9,Растровая графика. Adobe Photoshop CC,https://coursera.org/learn/rastrovaya-grafika-adobe-photoshop,4.6,Beginner Level,"['Computer Science', 'Design and Product']"
0,Entrepreneurship Strategy: From Ideation to Exit,https://coursera.org/learn/entrepreneurship-strategy,4.8,Beginner Level,"['Business', 'Leadership and Management']"
1,Conflict Resolution Skills,https://coursera.org/learn/conflict-resolution-skills,4.3,None,"['Business', 'Business Essentials']"
2,Serious Gaming,https://coursera.org/learn/serious-gaming,4.5,None,"['Social Sciences', 'Education']"
3,Введение в системное проектирование,https://coursera.org/learn/systems-engineering-2,4.4,Beginner Level,"['Physical Science and Engineering', 'Research Methods']"
