,Name,Url,Rating,Difficulty,Tags
0,Драгоценные камни: диагностика и экспертиза,https://coursera.org/learn/kamni,4.9,Beginner Level,"['Physical Science and Engineering', 'Research Methods']"
0,Investment Strategies and Portfolio Analysis,https://coursera.org/learn/investment-strategies-portfolio-analysis,4.1,None,"['Business', 'Finance']"
0,Intro to TensorFlow en Français,https://coursera.org/learn/intro-tensorflow-fr,None,Intermediate Level,"['Data Science', 'Machine Learning']"
0,Business English: Capstone Project,https://coursera.org/learn/business-english-capstone,4.7,Intermediate Level,"['Language Learning', 'Learning English']"
0,"Anatomy of the Chest, Abdomen, and Pelvis",https://coursera.org/learn/trunk-anatomy,4.7,Intermediate Level,"['Health', 'Basic Science']"
0,Feature Engineering auf Deutsch,https://coursera.org/learn/feature-engineering-de,None,Intermediate Level,"['Data Science', 'Machine Learning']"
0,International B2B (Business to Business) Marketing,https://coursera.org/learn/b2b-marketing,4.6,None,"['Business', 'Marketing']"
0,Effective Business Presentations with Powerpoint,https://coursera.org/learn/powerpoint-presentations,4.6,Beginner Level,"['Business', 'Business Essentials']"
0,Seeing Through Photographs,https://coursera.org/learn/photography,4.7,None,"['Arts and Humanities', 'Music and Art']"
0,Art & Activity: Interactive Strategies for Engaging with Art,https://coursera.org/learn/art-activity,4.7,None,"['Arts and Humanities', 'Music and Art']"
0,Макроэкономика  (вводный курс),https://coursera.org/learn/makroekonomika,4.5,Beginner Level,"['Business', 'Marketing']"
0,Essentials for English Speeches and Presentations  英语演讲与演示,https://coursera.org/learn/yingyuyanjiang,4.7,None,"['Personal Development', 'Personal Development']"
0,Introduction to Business Analytics: Communicating with Data,https://coursera.org/learn/intro-business-analytics,4.8,Intermediate Level,"['Business', 'Leadership and Management']"
0,Fundamentals of Fluid Power,https://coursera.org/learn/fluid-power,4.8,None,"['Physical Science and Engineering', 'Mechanical Engineering']"
0,الشبكات العصبية والتعلم العميق,https://coursera.org/learn/neural-networks-deep-learning-ar,None,Intermediate Level,"['Data Science', 'Machine Learning']"
0,Guided Imagery,https://coursera.org/learn/guided-imagery,4.7,Beginner Level,"['Health', 'Research']"
0,International Humanitarian Law in Theory and Practice,https://coursera.org/learn/international-humanitarian-law,4.8,Beginner Level,"['Social Sciences', 'Law']"
0,So You Think You Know Tango?,https://coursera.org/learn/tango,4.5,Beginner Level,"['Arts and Humanities', 'Music and Art']"
0,Chinese Characters for beginner 汉字,https://coursera.org/learn/hanzi,4.7,Beginner Level,"['Language Learning', 'Other Languages']"
0,Quality Improvement in Healthcare Organizations,https://coursera.org/learn/quality-improvement-in-healthcare-organizations,4.7,Beginner Level,"['Health', 'Healthcare Management']"
0,Population Health: Health & Health Behaviour,https://coursera.org/learn/population-health-behaviour,4,Intermediate Level,"['Health', 'Psychology']"
0,Strategic Innovation: Building and Sustaining Innovative Organizations,https://coursera.org/learn/strategic-innovation-building-and-sustaining-innovative-organizations,4.8,None,"['Business', 'Marketing']"
0,Intercultural Communication and Conflict Resolution,https://coursera.org/learn/intercultural-communication,4.2,None,"['Business', 'Business Essentials']"
0,"Social Services for Families, Seniors and Those with Disabilities",https://coursera.org/learn/social-health-policy-programs,4.7,None,"['Social Sciences', 'Governance and Society']"
0,Spanish Vocabulary: Meeting People,https://coursera.org/learn/spanish-vocabulary-meeting-people,4.6,Beginner Level,"['Language Learning', 'Other Languages']"
0,Understanding Obesity,https://coursera.org/learn/understanding-obesity,4.6,Beginner Level,"['Health', 'Nutrition']"
0,Machine Design Part I,https://coursera.org/learn/machine-design1,4.8,Intermediate Level,"['Physical Science and Engineering', 'Mechanical Engineering']"
0,Docencia para la capacitación laboral y el aprendizaje a lo largo de la vida.,https://coursera.org/learn/docencia-capacitacion-laboral,4.6,Intermediate Level,"['Social Sciences', 'Education']"
0,Learning Technologies Foundations and Applications,https://coursera.org/learn/learning-technologies-foundations-applications,4.4,None,"['Social Sciences', 'Education']"
0,Cyber Attack Countermeasures,https://coursera.org/learn/cyber-attack-countermeasures,4.8,Intermediate Level,"['Computer Science', 'Computer Security and Networks']"
0,Big Data Science with the BD2K-LINCS Data Coordination and Integration Center,https://coursera.org/learn/bd2k-lincs,4.9,Intermediate Level,"['Health', 'Basic Science']"
0,Project Practicum with Multiple Projects,https://coursera.org/learn/project-practicum-with-multiple-projects,4.7,Beginner Level,"['Business', 'Leadership and Management']"
0,"Medical Emergencies: Airway, Breathing, and Circulation",https://coursera.org/learn/medical-emergencies-airway-breathing-circulation,4.8,Beginner Level,"['Health', 'Patient Care']"
0,Operations Management: Strategy and Quality Management for the Digital Age,https://coursera.org/learn/process-improvement,4.5,None,"['Business', 'Business Strategy']"
0,Farmacovigilancia ocular,https://coursera.org/learn/farmacovigilancia-ocular,4.7,Intermediate Level,"['Health', 'Patient Care']"
0,Introduction to Ancient Egypt and Its Civilization,https://coursera.org/learn/introancientegypt,4.6,Intermediate Level,"['Arts and Humanities', 'History']"
0,Intercultural Management,https://coursera.org/learn/intercultural,4.5,Beginner Level,"['Business', 'Leadership and Management']"
0,Mind of the Universe: Science in Progress,https://coursera.org/learn/mind-of-the-universe-science-in-progress,4.6,Beginner Level,"['Arts and Humanities', 'Philosophy']"
0,Сетевое администрирование: от теории к практике,https://coursera.org/learn/network-administration,4.2,Intermediate Level,"['Computer Science', 'Computer Security and Networks']"
0,Agile Development in Practice (Project-centered Course),https://coursera.org/learn/uva-darden-agile-development-capstone,4.7,Intermediate Level,"['Computer Science', 'Design and Product']"
0,Business English: Basics,https://coursera.org/learn/business-english,4.5,None,"['Language Learning', 'Learning English']"
0,Camino a la Excelencia en Gestión de Proyectos,https://coursera.org/learn/camino-excelencia-gestion-proyectos,4.7,Beginner Level,"['Business', 'Leadership and Management']"
0,"Country Level Economics: Policies, Institutions, and Macroeconomic Performance",https://coursera.org/learn/macroeconomic-factors,4.4,Beginner Level,"['Business', 'Finance']"
0,Materials in Oral Health,https://coursera.org/learn/materials-oral-health,4.6,None,"['Health', 'Basic Science']"
0,"Sleep: Neurobiology, Medicine, and Society",https://coursera.org/learn/sleep,4.8,Beginner Level,"['Health', 'Basic Science']"
0,"Creativity, Innovation, and Change",https://coursera.org/learn/creativity-innovation,4.4,None,"['Physical Science and Engineering', 'Environmental Science and Sustainability']"
0,Battery Pack Balancing and Power Estimation,https://coursera.org/learn/battery-pack-balancing-power-estimation,4.9,Intermediate Level,"['Physical Science and Engineering', 'Electrical Engineering']"
0,"Easing the burden of obesity, diabetes and cardiovascular disease",https://coursera.org/learn/easing-the-burden-of-obesity-diabetes-cvd,4.5,Beginner Level,"['Health', 'Public Health']"
0,What is Palliative Care?,https://coursera.org/learn/what-is-palliative-care,4.8,Beginner Level,"['Health', 'Patient Care']"
0,General Chemistry: Concept Development and Application,https://coursera.org/learn/general-chemistry,4.6,None,"['Physical Science and Engineering', 'Chemistry']"
0,Основы разработки на C++: красный пояс,https://coursera.org/learn/c-plus-plus-red,4.8,Intermediate Level,"['Computer Science', 'Software Development']"
0,Spatial Analysis and Satellite Imagery in a GIS,https://coursera.org/learn/spatial-analysis-satellite-imagery-in-a-gis,4.8,Beginner Level,"['Physical Science and Engineering', 'Environmental Science and Sustainability']"
0,Non-Equilibrium Applications of Statistical Thermodynamics,https://coursera.org/learn/stats-thermo-non-equilibrium-applications,None,Advanced Level,"['Physical Science and Engineering', 'Mechanical Engineering']"
0,Successful Interviewing,https://coursera.org/learn/successful-interviewing,4.7,None,"['Language Learning', 'Learning English']"
0,"Dopage : Sports, Organisations et Sciences",https://coursera.org/learn/dopage,4.7,None,"['Health', 'Psychology']"
0,Introducción a la Producción Audiovisual,https://coursera.org/learn/intro-produccion-audiovisual,4.7,Beginner Level,"['Social Sciences', 'Education']"
0,Data Visualization with Advanced Excel,https://coursera.org/learn/advanced-excel,4.8,Beginner Level,"['Data Science', 'Data Analysis']"
0,Sistemas Operacionais e Você: Tornando-se um Usuário Avançado,https://coursera.org/learn/sistemas-operacionais,4.9,Beginner Level,"['Information Technology', 'Support and Operations']"
0,Using Data for Geographic Mapping and Forecasting in SAS Visual Analytics,https://coursera.org/learn/using-data-geographic-mapping-sas-va,None,Intermediate Level,"['Data Science', 'Data Analysis']"
0,"Film, Images & Historical Interpretation in the 20th Century: The Camera Never Lies",https://coursera.org/learn/film-images,4.3,Beginner Level,"['Arts and Humanities', 'History']"
0,American Deaf Culture,https://coursera.org/learn/deaf-culture,4.4,Beginner Level,"['Language Learning', 'Learning English']"
0,Communication in the 21st Century Workplace,https://coursera.org/learn/communication-in-the-workplace,4.2,None,"['Business', 'Business Essentials']"
0,"Anticipating Your Next Battle, in Business and Beyond",https://coursera.org/learn/anticipate,4.5,Beginner Level,"['Business', 'Business Strategy']"
0,Mastering Final Cut Pro,https://coursera.org/learn/mastering-final-cut-pro,None,Beginner Level,"['Business', 'Business Essentials']"
0,Validity and Bias in Epidemiology,https://coursera.org/learn/validity-bias-epidemiology,4.8,Intermediate Level,"['Health', 'Public Health']"
0,Valuation for Startups Using Discounted Cash Flows Approach,https://coursera.org/learn/discounted-cash-flow,4.3,Beginner Level,"['Business', 'Finance']"
0,Writing in the Sciences,https://coursera.org/learn/sciwrite,4.9,Beginner Level,"['Health', 'Basic Science']"
0,The Fundamentals of Computing Capstone Exam,https://coursera.org/learn/fundamentals-of-computing-capstone,4.8,Intermediate Level,"['Computer Science', 'Software Development']"
0,Introduction to Blockchain Technologies,https://coursera.org/learn/introduction-blockchain-technologies,4.8,Beginner Level,"['Business', 'Business Essentials']"
0,Recolección y exploración de datos,https://coursera.org/learn/ordenamiento-datos,4.2,None,"['Business', 'Business Strategy']"
0,"Основы поиска дела жизни. Часть 2. Что скрывается за вопросом ""Как найти себя?""",https://coursera.org/learn/kak-naiti-sebya,4.8,Beginner Level,"['Personal Development', 'Personal Development']"
0,The Global Financial Crisis,https://coursera.org/learn/global-financial-crisis,4.8,None,"['Social Sciences', 'Economics']"
0,How Things Work: An Introduction to Physics,https://coursera.org/learn/how-things-work,4.7,Intermediate Level,"['Physical Science and Engineering', 'Physics and Astronomy']"
0,Country Level Economics: Macroeconomic Variables and Markets,https://coursera.org/learn/country-level-economics,4.2,None,"['Business', 'Finance']"
0,Riesgos y oportunidades empresariales en una economía globalizada,https://coursera.org/learn/riesgos-oportunidades-empresariales,5,Intermediate Level,"['Social Sciences', 'Economics']"
0,El Valle de los Reyes,https://coursera.org/learn/valle-de-los-reyes,4.9,Beginner Level,"['Arts and Humanities', 'History']"
0,Introduction to CSS3,https://coursera.org/learn/introcss,4.8,None,"['Computer Science', 'Mobile and Web Development']"
0,Software Design Threats and Mitigations,https://coursera.org/learn/software-design-threats-mitigations,4.8,Intermediate Level,"['Computer Science', 'Software Development']"
0,Autodesk Certified Professional: Revit for Structural Design Exam Prep,https://coursera.org/learn/autodesk-revit-for-structural-design-exam-prep,4.8,Advanced Level,"['Physical Science and Engineering', 'Mechanical Engineering']"
0,Data Modeling and Regression Analysis in Business,https://coursera.org/learn/data-modeling-regression-analysis-business,4.3,Intermediate Level,"['Business', 'Leadership and Management']"
0,Learn to Speak Korean 1,https://coursera.org/learn/learn-speak-korean1,4.9,Beginner Level,"['Language Learning', 'Other Languages']"
0,Writing for Young Readers: Opening the Treasure Chest,https://coursera.org/learn/writing-for-children,4.7,None,"['Language Learning', 'Learning English']"
0,Private Equity and Venture Capital,https://coursera.org/learn/private-equity,4.8,None,"['Business', 'Finance']"
0,The Role of Global Capital Markets,https://coursera.org/learn/capital-markets,4.6,None,"['Business', 'Finance']"
0,Cómo entrenar a tus electrones 2: Diodos y Transistores,https://coursera.org/learn/entrenar-electrones-diodos-transistores,4.9,Intermediate Level,"['Physical Science and Engineering', 'Electrical Engineering']"
0,Finance for Non-Financial Managers,https://coursera.org/learn/finance-for-non-financial-managers,4.5,Intermediate Level,"['Business', 'Finance']"
0,Ideas from the History of Graphic Design,https://coursera.org/learn/graphic-design-history,4.7,Beginner Level,"['Arts and Humanities', 'History']"
0,Applying Data Analytics in Finance,https://coursera.org/learn/applying-data-analytics-business-in-finance,4.6,Intermediate Level,"['Business', 'Leadership and Management']"
0,Personality Types at Work,https://coursera.org/learn/personality-types-at-work,4.4,Beginner Level,"['Personal Development', 'Personal Development']"
0,Global Financial Markets and Instruments,https://coursera.org/learn/global-financial-markets-instruments,4.6,None,"['Business', 'Finance']"
0,Engineering Design Process with Autodesk Fusion 360,https://coursera.org/learn/engineering-design-process-fusion-360,4.7,Advanced Level,"['Physical Science and Engineering', 'Mechanical Engineering']"
0,My Favorite Lectures @ HKUST,https://coursera.org/learn/my-favorite-lectures-hkust,None,Beginner Level,"['Social Sciences', 'Education']"
0,Computational Thinking for K-12 Educators: Conditional Loops and If Statements,https://coursera.org/learn/block-programming-k12-educators-conditional-loops-if-statement,None,Beginner Level,"['Social Sciences', 'Education']"
0,Advanced Interviewing Techniques,https://coursera.org/learn/interview-techniques,4.7,None,"['Language Learning', 'Learning English']"
0,Hybrid Cloud Infrastructure Foundations with Anthos,https://coursera.org/learn/hybrid-cloud-infrastructure-foundations-anthos,4.8,Intermediate Level,"['Information Technology', 'Cloud Computing']"
0,Introduction to Negotiation: A Strategic Playbook for Becoming a Principled and Persuasive Negotiator,https://coursera.org/learn/negotiation,4.8,None,"['Business', 'Business Essentials']"
0,Accounting Analytics,https://coursera.org/learn/accounting-analytics,4.5,None,"['Business', 'Finance']"
0,"Engineering Life: Synbio, Bioethics & Public Policy",https://coursera.org/learn/synbioethics,4.5,Intermediate Level,"['Health', 'Public Health']"
0,Introduction to Cybersecurity for Business,https://coursera.org/learn/intro-cyber-security-business,4.7,Beginner Level,"['Information Technology', 'Security']"
0,Financing and Investing in Infrastructure,https://coursera.org/learn/infrastructure-investing,4.8,None,"['Business', 'Finance']"
0,Fundamentos del marketing mix,https://coursera.org/learn/fundamentos-marketing-mix,4.5,Beginner Level,"['Business', 'Marketing']"
0,IA para todos,https://coursera.org/learn/ai-for-everyone-es,4.9,Beginner Level,"['Business', 'Business Strategy']"
0,Technical Support Fundamentals,https://coursera.org/learn/technical-support-fundamentals,4.8,Beginner Level,"['Information Technology', 'Support and Operations']"
0,Capstone: Analyzing (Social) Network Data,https://coursera.org/learn/intermediate-programming-capstone,4.7,None,"['Data Science', 'Data Analysis']"
0,Jacobi modular forms: 30 ans après,https://coursera.org/learn/modular-forms-jacobi,4.8,Advanced Level,"['Math and Logic', 'Math and Logic']"
0,Better Business Writing in English,https://coursera.org/learn/business-writing-english,4.5,Beginner Level,"['Language Learning', 'Learning English']"
0,Sustainable Innovation for Subsistence Marketplaces,https://coursera.org/learn/subsistence-marketplaces-1,4.5,Beginner Level,"['Business', 'Leadership and Management']"
0,Systèmes d’Information Géographique - Partie 2,https://coursera.org/learn/sig-2,4.3,Beginner Level,"['Physical Science and Engineering', 'Environmental Science and Sustainability']"
0,التسويق في عالم رقمي,https://coursera.org/learn/marketing-digital-ar,None,Beginner Level,"['Business', 'Marketing']"
0,Customer Analytics,https://coursera.org/learn/wharton-customer-analytics,4.5,None,"['Business', 'Business Strategy']"
0,Identifying Security Vulnerabilities in C/C++Programming,https://coursera.org/learn/identifying-security-vulnerabilities-c-programming,4.8,Intermediate Level,"['Computer Science', 'Computer Security and Networks']"
0,"Energy, Environment, and Everyday Life",https://coursera.org/learn/energy-environment-life,4.8,Beginner Level,"['Physical Science and Engineering', 'Environmental Science and Sustainability']"
0,Federal Taxation II: Property Transactions of Business Owners and Shareholders,https://coursera.org/learn/federal-taxation-business,4.9,Intermediate Level,"['Business', 'Business Essentials']"
0,Wharton Business Foundations Capstone,https://coursera.org/learn/wharton-capstone,4.6,None,"['Business', 'Business Essentials']"
0,Gestion del alcance: el qué de la triple restricción,https://coursera.org/learn/gestion-alcance-proyectos,None,Intermediate Level,"['Business', 'Leadership and Management']"
0,Action-Driven Business Plan: From the ‘Classroom’ to the World,https://coursera.org/learn/startup-entrepreneurship-capstone,None,None,"['Business', 'Entrepreneurship']"
0,Introduction into General Theory of Relativity,https://coursera.org/learn/general-relativity,4.6,Advanced Level,"['Physical Science and Engineering', 'Physics and Astronomy']"
0,World Design for Video Games,https://coursera.org/learn/video-game-world,4.4,Beginner Level,"['Arts and Humanities', 'Music and Art']"
0,Introduction to UI Design,https://coursera.org/learn/ui-design,4.7,Beginner Level,"['Computer Science', 'Design and Product']"
0,Electrodynamics: Electric and Magnetic Fields,https://coursera.org/learn/electrodynamics-electric-magnetic-fields,4.7,Advanced Level,"['Physical Science and Engineering', 'Electrical Engineering']"
0,Методологические проблемы психологии. Часть 2,https://coursera.org/learn/method-psychology-pt2,None,Beginner Level,"['Health', 'Psychology']"
0,Music as Biology: What We Like to Hear and Why,https://coursera.org/learn/music-as-biology,4.2,None,"['Health', 'Basic Science']"
0,Writing Professional Email and Memos (Project-Centered Course),https://coursera.org/learn/professional-emails,4.3,None,"['Business', 'Business Essentials']"
0,Stanford Introduction to Food and Health,https://coursera.org/learn/food-and-health,4.7,Beginner Level,"['Health', 'Nutrition']"
0,Creating Dashboards and Storytelling with Tableau,https://coursera.org/learn/dataviz-dashboards,4.6,Beginner Level,"['Data Science', 'Data Analysis']"
0,Entrepreneurship 4: Financing and Profitability,https://coursera.org/learn/wharton-entrepreneurship-financing-profitabilty,4.8,None,"['Business', 'Entrepreneurship']"
0,Getting Started on Mainframe with z/OS Commands and Panels,https://coursera.org/learn/z-commands-and-panels,4.8,Intermediate Level,"['Information Technology', 'Data Management']"
0,Serverless Data Analysis with Google BigQuery and Cloud Dataflow en Español,https://coursera.org/learn/serverless-data-analysis-bigquery-cloud-dataflow-gcp-es,4.8,Intermediate Level,"['Computer Science', 'Software Development']"
0,Fundamentals of Immunology: Innate Immunity and B-Cell Function,https://coursera.org/learn/immunologyfundamentalsimmunitybcells,4.7,Intermediate Level,"['Health', 'Basic Science']"
0,Culture-Driven Team Building Capstone,https://coursera.org/learn/team-building-capstone,4.5,Beginner Level,"['Business', 'Leadership and Management']"
0,Economie du sol et de l'immobilier I,https://coursera.org/learn/economie-sol-immobilier-1,4.7,Intermediate Level,"['Social Sciences', 'Economics']"
0,Public Health in Humanitarian Crises 2,https://coursera.org/learn/humanitarian-public-health-2,None,Beginner Level,"['Health', 'Public Health']"
0,Probabilistic Graphical Models 1: Representation,https://coursera.org/learn/probabilistic-graphical-models,4.7,Advanced Level,"['Data Science', 'Machine Learning']"
0,Inclusión social de personas con discapacidad desde un enfoque de derechos.,https://coursera.org/learn/inclusion-social-personas-discapacidad,None,Beginner Level,"['Health', 'Public Health']"
0,International Women's Health and Human Rights,https://coursera.org/learn/womens-health-human-rights,4.9,Beginner Level,"['Health', 'Public Health']"
0,Journey Conversations: Weaving Knowledge and Action,https://coursera.org/learn/journey-knowledge-action,4.8,None,"['Physical Science and Engineering', 'Environmental Science and Sustainability']"
0,Creating a Team Culture of Continuous Learning,https://coursera.org/learn/continuous-learning-culture,4.6,None,"['Business', 'Leadership and Management']"
0,Organizational Leadership Capstone,https://coursera.org/learn/leadership-capstone,4.7,None,"['Business', 'Leadership and Management']"
0,Becoming a changemaker: Introduction to Social Innovation,https://coursera.org/learn/social-innovation,4.8,Beginner Level,"['Business', 'Entrepreneurship']"
0,Data Science Capstone,https://coursera.org/learn/data-science-project,4.5,None,"['Data Science', 'Data Analysis']"
0,International Hospitality & Healthcare Services Marketing,https://coursera.org/learn/healthcare-marketing-hospitality-management,4.6,None,"['Business', 'Marketing']"
0,Innovation: From Creativity to Entrepreneurship Capstone,https://coursera.org/learn/innovation-creativity-entrepreneurship-capstone,4.3,Beginner Level,"['Business', 'Entrepreneurship']"
0,Introduction to Search Engine Optimization,https://coursera.org/learn/search-engine-optimization,4.6,None,"['Business', 'Marketing']"
0,"Planning, Auditing and Maintaining Enterprise Systems",https://coursera.org/learn/planning-auditing-maintaining-enterprise-systems,4.6,Intermediate Level,"['Information Technology', 'Security']"
0,Introduction to the Digital Advertising Landscape,https://coursera.org/learn/digital-advertising-landscape,4.8,Beginner Level,"['Business', 'Marketing']"
0,Lesson | Business English Skills: How to Write Effective Openings and Closings to Emails,https://coursera.org/learn/lesson-business-english-skills-how-to-write-effective-openings-and-closings-to-emails,None,Intermediate Level,"['Language Learning', 'Learning English']"
0,"Divide and Conquer, Sorting and Searching, and Randomized Algorithms",https://coursera.org/learn/algorithms-divide-conquer,4.8,Intermediate Level,"['Computer Science', 'Algorithms']"
0,Negociación exitosa: Estrategias y habilidades esenciales (en español),https://coursera.org/learn/negociacion,4.8,None,"['Business', 'Business Essentials']"
0,Modern & Contemporary American Poetry (“ModPo”),https://coursera.org/learn/modpo,4.9,Beginner Level,"['Arts and Humanities', 'Music and Art']"
0,Master Class for Corporate Entrepreneurs,https://coursera.org/learn/corporate-entrepreneurship-project,4.5,Beginner Level,"['Business', 'Entrepreneurship']"
0,The Talmud: A Methodological Introduction,https://coursera.org/learn/the-talmud,4.6,None,"['Arts and Humanities', 'History']"
0,Nutrición y obesidad: control de sobrepeso,https://coursera.org/learn/nutricion-obesidad-sobrepeso,4.8,Beginner Level,"['Health', 'Nutrition']"
0,Государственно-частное партнерство в инфраструктурном развитии России,https://coursera.org/learn/gosudarstvenno-chastnoye-partnerstvo,4.9,Beginner Level,"['Business', 'Business Strategy']"
0,Expanding SEL,https://coursera.org/learn/expanding-sel,4.8,Advanced Level,"['Social Sciences', 'Education']"
0,Ecology: from cells to Gaia,https://coursera.org/learn/ecology,4.3,Intermediate Level,"['Health', 'Basic Science']"
0,Practical SAS Programming and Certification Review,https://coursera.org/learn/sas-programming-certification-review,4.8,Intermediate Level,"['Data Science', 'Data Analysis']"
0,Text Retrieval and Search Engines,https://coursera.org/learn/text-retrieval,4.4,None,"['Data Science', 'Data Analysis']"
0,Financial Reporting Capstone,https://coursera.org/learn/financial-reporting-capstone,4.3,Intermediate Level,"['Business', 'Business Essentials']"
0,How to Validate your Startup Idea,https://coursera.org/learn/startup-idea,4.4,None,"['Business', 'Entrepreneurship']"
0,The Neuromarketing Toolbox,https://coursera.org/learn/neuromarketing-toolbox,4.4,Beginner Level,"['Business', 'Marketing']"
0,Desarrollo y Diseño de Videojuegos: Proyecto final,https://coursera.org/learn/proyecto-desarrollo-videojuegos,5,Intermediate Level,"['Computer Science', 'Design and Product']"
